{
  "spec_id": "flowchart-golden-03",
  "domain": "computer_science",
  "risk_level": "medium",
  "claims": [
    {
      "claim_id": "claim-node-count-matches",
      "rule_id": "flowchart-v1.node-count-matches",
      "check_id": "node-count-matches",
      "check_type": "node_count_matches",
      "severity": "high",
      "target": "nodes",
      "expected": {
        "count": 4
      },
      "tolerance": {},
      "evidence_requirements": [
        "node_geometry"
      ],
      "metadata": {
        "description": "The number of detected nodes should match the declared nodes.",
        "learning_objective": "Read a vertical-chain flowchart where each node has the correct shape, color identity, and label, and each directed connector links the declared nodes."
      }
    },
    {
      "claim_id": "claim-required-nodes-present",
      "rule_id": "flowchart-v1.required-nodes-present",
      "check_id": "required-nodes-present",
      "check_type": "required_nodes_present",
      "severity": "critical",
      "target": "nodes",
      "expected": {
        "nodes_by_id": {
          "start": {
            "rgb": [
              214,
              48,
              49
            ],
            "name": "Start"
          },
          "decision": {
            "rgb": [
              230,
              126,
              34
            ],
            "name": "Decision"
          },
          "left": {
            "rgb": [
              0,
              148,
              50
            ],
            "name": "Left branch"
          },
          "right": {
            "rgb": [
              142,
              68,
              173
            ],
            "name": "Right branch"
          }
        }
      },
      "tolerance": {
        "color_match_distance": 60.0
      },
      "evidence_requirements": [
        "node_geometry",
        "node_color"
      ],
      "metadata": {
        "description": "Every required node must be present with its declared color identity.",
        "learning_objective": "Read a vertical-chain flowchart where each node has the correct shape, color identity, and label, and each directed connector links the declared nodes."
      }
    },
    {
      "claim_id": "claim-node-shape-correct",
      "rule_id": "flowchart-v1.node-shape-correct",
      "check_id": "node-shape-correct",
      "check_type": "node_shape_correct",
      "severity": "critical",
      "target": "nodes",
      "expected": {
        "nodes_by_id": {
          "start": {
            "rgb": [
              214,
              48,
              49
            ],
            "shape": "rectangle"
          },
          "decision": {
            "rgb": [
              230,
              126,
              34
            ],
            "shape": "diamond"
          },
          "left": {
            "rgb": [
              0,
              148,
              50
            ],
            "shape": "rectangle"
          },
          "right": {
            "rgb": [
              142,
              68,
              173
            ],
            "shape": "rectangle"
          }
        }
      },
      "tolerance": {
        "color_match_distance": 60.0
      },
      "evidence_requirements": [
        "node_geometry",
        "node_color"
      ],
      "metadata": {
        "description": "Each node must render with its declared shape (rectangle or diamond).",
        "learning_objective": "Read a vertical-chain flowchart where each node has the correct shape, color identity, and label, and each directed connector links the declared nodes."
      }
    },
    {
      "claim_id": "claim-node-label-correct",
      "rule_id": "flowchart-v1.node-label-correct",
      "check_id": "node-label-correct",
      "check_type": "node_label_correct",
      "severity": "high",
      "target": "nodes",
      "expected": {
        "nodes_by_id": {
          "start": {
            "rgb": [
              214,
              48,
              49
            ],
            "label_text": "Start"
          },
          "decision": {
            "rgb": [
              230,
              126,
              34
            ],
            "label_text": "Decision"
          },
          "left": {
            "rgb": [
              0,
              148,
              50
            ],
            "label_text": "Output"
          },
          "right": {
            "rgb": [
              142,
              68,
              173
            ],
            "label_text": "End"
          }
        }
      },
      "tolerance": {
        "color_match_distance": 60.0
      },
      "evidence_requirements": [
        "node_geometry",
        "node_color",
        "node_label_text"
      ],
      "metadata": {
        "description": "Each labeled node's decoded text must match its declared label.",
        "learning_objective": "Read a vertical-chain flowchart where each node has the correct shape, color identity, and label, and each directed connector links the declared nodes."
      }
    },
    {
      "claim_id": "claim-connector-links-correct",
      "rule_id": "flowchart-v1.connector-links-correct",
      "check_id": "connector-links-correct",
      "check_type": "connector_links_correct",
      "severity": "critical",
      "target": "connectors",
      "expected": {
        "ordered_edges": [
          [
            "start",
            "decision"
          ],
          [
            "decision",
            "left"
          ],
          [
            "decision",
            "right"
          ]
        ],
        "nodes_by_id": {
          "start": {
            "rgb": [
              214,
              48,
              49
            ]
          },
          "decision": {
            "rgb": [
              230,
              126,
              34
            ]
          },
          "left": {
            "rgb": [
              0,
              148,
              50
            ]
          },
          "right": {
            "rgb": [
              142,
              68,
              173
            ]
          }
        }
      },
      "tolerance": {
        "color_match_distance": 60.0
      },
      "evidence_requirements": [
        "node_geometry",
        "node_color",
        "connector_geometry"
      ],
      "metadata": {
        "description": "Every declared directed connector must be found in the rendered arrow evidence.",
        "learning_objective": "Read a vertical-chain flowchart where each node has the correct shape, color identity, and label, and each directed connector links the declared nodes."
      }
    }
  ],
  "gaps": [],
  "source_reference": {
    "nodes": [
      {
        "id": "start",
        "name": "Start",
        "rgb": [
          214,
          48,
          49
        ],
        "shape": "rectangle",
        "label_text": "Start"
      },
      {
        "id": "decision",
        "name": "Decision",
        "rgb": [
          230,
          126,
          34
        ],
        "shape": "diamond",
        "label_text": "Decision"
      },
      {
        "id": "left",
        "name": "Left branch",
        "rgb": [
          0,
          148,
          50
        ],
        "shape": "rectangle",
        "label_text": "Output"
      },
      {
        "id": "right",
        "name": "Right branch",
        "rgb": [
          142,
          68,
          173
        ],
        "shape": "rectangle",
        "label_text": "End"
      }
    ],
    "connectors": [
      {
        "from_id": "start",
        "to_id": "decision"
      },
      {
        "from_id": "decision",
        "to_id": "left"
      },
      {
        "from_id": "decision",
        "to_id": "right"
      }
    ]
  },
  "metadata": {
    "generator": "flowchart-v1",
    "spec_path": "..\\datasets\\flowchart\\flowchart-v1\\golden\\golden-03\\visual_spec.json",
    "required_elements": [
      {
        "id": "nodes",
        "kind": "node",
        "name": "flowchart nodes",
        "count": 4
      }
    ]
  }
}