{
  "spec_id": "coordinate-mutated-07",
  "domain": "mathematics",
  "risk_level": "medium",
  "claims": [
    {
      "claim_id": "claim-point-count-matches",
      "rule_id": "coordinate-graph-v1.point-count-matches",
      "check_id": "point-count-matches",
      "check_type": "point_count_matches",
      "severity": "high",
      "target": "points",
      "expected": {
        "count": 4
      },
      "tolerance": {},
      "evidence_requirements": [
        "point_geometry"
      ],
      "metadata": {
        "description": "The number of detected scatter points should match the declared points.",
        "learning_objective": "Read a coordinate plane where each scatter point has the correct position and color identity, and the connecting polyline links the declared points in order."
      }
    },
    {
      "claim_id": "claim-required-points-present",
      "rule_id": "coordinate-graph-v1.required-points-present",
      "check_id": "required-points-present",
      "check_type": "required_points_present",
      "severity": "critical",
      "target": "points",
      "expected": {
        "points_by_id": {
          "p1": {
            "rgb": [
              214,
              48,
              49
            ],
            "name": "Point 1",
            "label_text": null
          },
          "p2": {
            "rgb": [
              9,
              132,
              227
            ],
            "name": "Point 2",
            "label_text": null
          },
          "p3": {
            "rgb": [
              0,
              148,
              50
            ],
            "name": "Point 3",
            "label_text": null
          },
          "p4": {
            "rgb": [
              142,
              68,
              173
            ],
            "name": "Point 4",
            "label_text": null
          }
        }
      },
      "tolerance": {
        "color_match_distance": 60.0
      },
      "evidence_requirements": [
        "point_geometry",
        "point_color"
      ],
      "metadata": {
        "description": "Every required point must be present with its declared color identity.",
        "learning_objective": "Read a coordinate plane where each scatter point has the correct position and color identity, and the connecting polyline links the declared points in order."
      }
    },
    {
      "claim_id": "claim-point-positions-correct",
      "rule_id": "coordinate-graph-v1.point-positions-correct",
      "check_id": "point-positions-correct",
      "check_type": "point_positions_correct",
      "severity": "critical",
      "target": "points",
      "expected": {
        "points_by_id": {
          "p1": {
            "rgb": [
              214,
              48,
              49
            ],
            "x": 10,
            "y": 5,
            "label_text": null
          },
          "p2": {
            "rgb": [
              9,
              132,
              227
            ],
            "x": 40,
            "y": 15,
            "label_text": null
          },
          "p3": {
            "rgb": [
              0,
              148,
              50
            ],
            "x": 70,
            "y": 35,
            "label_text": null
          },
          "p4": {
            "rgb": [
              142,
              68,
              173
            ],
            "x": 95,
            "y": 48,
            "label_text": null
          }
        }
      },
      "tolerance": {
        "color_match_distance": 60.0,
        "position_tolerance_x": 3.0,
        "position_tolerance_y": 1.5
      },
      "evidence_requirements": [
        "point_geometry",
        "point_color",
        "axis_mapping"
      ],
      "metadata": {
        "description": "Each point's data-space position, derived from independent X/Y axis scales, must match its declared position within tolerance.",
        "learning_objective": "Read a coordinate plane where each scatter point has the correct position and color identity, and the connecting polyline links the declared points in order."
      }
    },
    {
      "claim_id": "claim-axis-scale-correct",
      "rule_id": "coordinate-graph-v1.axis-scale-correct",
      "check_id": "axis-scale-correct",
      "check_type": "axis_scale_correct",
      "severity": "critical",
      "target": "axes",
      "expected": {
        "x_axis": {
          "expected_min": 0,
          "expected_max": 100
        },
        "y_axis": {
          "expected_min": 0,
          "expected_max": 50
        }
      },
      "tolerance": {
        "axis_value_tolerance": 0.5
      },
      "evidence_requirements": [
        "axis_mapping"
      ],
      "metadata": {
        "description": "The displayed X and Y axis ranges must match the declared spec ranges.",
        "learning_objective": "Read a coordinate plane where each scatter point has the correct position and color identity, and the connecting polyline links the declared points in order."
      }
    },
    {
      "claim_id": "claim-polyline-connections-correct",
      "rule_id": "coordinate-graph-v1.polyline-connections-correct",
      "check_id": "polyline-connections-correct",
      "check_type": "polyline_connections_correct",
      "severity": "high",
      "target": "polyline",
      "expected": {
        "series": [
          {
            "series_id": "series-1",
            "ordered_point_ids": [
              "p1",
              "p2",
              "p3",
              "p4"
            ]
          }
        ],
        "points_by_id": {
          "p1": {
            "rgb": [
              214,
              48,
              49
            ],
            "label_text": null
          },
          "p2": {
            "rgb": [
              9,
              132,
              227
            ],
            "label_text": null
          },
          "p3": {
            "rgb": [
              0,
              148,
              50
            ],
            "label_text": null
          },
          "p4": {
            "rgb": [
              142,
              68,
              173
            ],
            "label_text": null
          }
        }
      },
      "tolerance": {
        "color_match_distance": 60.0
      },
      "evidence_requirements": [
        "point_geometry",
        "point_color",
        "polyline_edges"
      ],
      "metadata": {
        "description": "The declared ordered polyline must connect its points in the declared order, verified against rendered line-pixel evidence.",
        "learning_objective": "Read a coordinate plane where each scatter point has the correct position and color identity, and the connecting polyline links the declared points in order."
      }
    }
  ],
  "gaps": [],
  "source_reference": {
    "x_axis": {
      "min": 0,
      "max": 100
    },
    "y_axis": {
      "min": 0,
      "max": 50
    },
    "points": [
      {
        "id": "p1",
        "name": "Point 1",
        "rgb": [
          214,
          48,
          49
        ],
        "x": 10,
        "y": 5,
        "label_text": null
      },
      {
        "id": "p2",
        "name": "Point 2",
        "rgb": [
          9,
          132,
          227
        ],
        "x": 40,
        "y": 15,
        "label_text": null
      },
      {
        "id": "p3",
        "name": "Point 3",
        "rgb": [
          0,
          148,
          50
        ],
        "x": 70,
        "y": 35,
        "label_text": null
      },
      {
        "id": "p4",
        "name": "Point 4",
        "rgb": [
          142,
          68,
          173
        ],
        "x": 95,
        "y": 48,
        "label_text": null
      }
    ],
    "polyline": {
      "ordered_point_ids": [
        "p1",
        "p2",
        "p3",
        "p4"
      ]
    }
  },
  "metadata": {
    "generator": "coordinate-graph-v1",
    "spec_path": "..\\datasets\\coordinate\\coordinate-graph-v1\\mutated\\mutated-07\\visual_spec.json",
    "required_elements": [
      {
        "id": "points",
        "kind": "point",
        "name": "scatter points",
        "count": 4
      }
    ]
  }
}