{
  "spec_id": "geometry-noisy-downscale-golden-01",
  "domain": "mechanical",
  "risk_level": "medium",
  "claims": [
    {
      "claim_id": "claim-hole-count-correct",
      "rule_id": "geometry-v1.hole-count-correct",
      "check_id": "hole-count-correct",
      "check_type": "hole_count_correct",
      "severity": "high",
      "target": "holes",
      "expected": {
        "count": 1
      },
      "tolerance": {},
      "evidence_requirements": [
        "hole_geometry"
      ],
      "metadata": {
        "description": "The number of detected circular holes should match the declared holes.",
        "learning_objective": "Read a mechanical part illustration where each drilled hole has the correct count, relative diameter, position, and dimension callout."
      }
    },
    {
      "claim_id": "claim-hole-diameter-ratio-correct",
      "rule_id": "geometry-v1.hole-diameter-ratio-correct",
      "check_id": "hole-diameter-ratio-correct",
      "check_type": "hole_diameter_ratio_correct",
      "severity": "critical",
      "target": "holes",
      "expected": {
        "ordered_holes": [
          {
            "id": "hole-a",
            "diameter": 12
          }
        ]
      },
      "tolerance": {
        "diameter_ratio_tolerance": 0.12
      },
      "evidence_requirements": [
        "hole_geometry"
      ],
      "metadata": {
        "description": "Measured hole diameter ratios must match the declared nominal diameter ratios (no pixel-to-unit calibration in v1).",
        "learning_objective": "Read a mechanical part illustration where each drilled hole has the correct count, relative diameter, position, and dimension callout."
      }
    },
    {
      "claim_id": "claim-dimension-text-correct",
      "rule_id": "geometry-v1.dimension-text-correct",
      "check_id": "dimension-text-correct",
      "check_type": "dimension_text_correct",
      "severity": "critical",
      "target": "holes",
      "expected": {
        "ordered_holes": [
          {
            "id": "hole-a",
            "dimension_text": "D12"
          }
        ]
      },
      "tolerance": {},
      "evidence_requirements": [
        "hole_geometry",
        "dimension_text"
      ],
      "metadata": {
        "description": "Each hole's dimension callout text must match the declared dimension.",
        "learning_objective": "Read a mechanical part illustration where each drilled hole has the correct count, relative diameter, position, and dimension callout."
      }
    }
  ],
  "gaps": [],
  "source_reference": {
    "plate": {
      "kind": "rectangle"
    },
    "holes": [
      {
        "id": "hole-a",
        "diameter": 12,
        "dimension_text": "D12"
      }
    ]
  },
  "metadata": {
    "generator": "geometry-v1",
    "spec_path": "datasets\\mechanical\\geometry-v1-noisy\\golden\\noisy-downscale-golden-01\\visual_spec.json",
    "required_elements": [
      {
        "id": "plate",
        "kind": "rectangle",
        "name": "plate under illustration",
        "count": 1
      },
      {
        "id": "holes",
        "kind": "circle",
        "name": "drilled holes",
        "count": 1
      }
    ]
  }
}